{
  "schema_version": "1.0",
  "tool_version": "0.1.0a1",
  "session_id": "24c421c5c6b4408e9a4de739b7c88f88",
  "created_at": "2026-09-22T02:35:20.834172+00:00",
  "synthetic": false,
  "config": {
    "backend": "llama_cpp",
    "server": "D:\\LocalLargeModel\\runtimes\\upstream\\llama-server.exe",
    "model": "D:\\LocalLargeModel\\outputs\\quality-study\\prepared-v2\\Qwen3-1.7B-F16.gguf",
    "model_id": "Qwen/Qwen3-1.7B",
    "quantization": "F16",
    "expected_model_sha256": "88d9134f85eec8ce75f39d2654fbcfd570fdda68821936ded67b177c0d4b326e",
    "cases": [
      {
        "name": "ctx2k",
        "context_size": 2048,
        "prompt_tokens": 1792,
        "output_tokens": 128,
        "gpu_layers": 99,
        "threads": 6,
        "batch_size": 512,
        "ubatch_size": 128,
        "cache_type_k": "f16",
        "cache_type_v": "f16",
        "flash_attention": "on",
        "fallbacks": []
      }
    ],
    "repetitions": 1,
    "seed": 42,
    "gpu_index": 0,
    "load_timeout_seconds": 90,
    "request_timeout_seconds": 90,
    "sample_interval_seconds": 0.5,
    "quality": false,
    "quality_suite": null,
    "notes": "Uncontrolled desktop; rotating quantization order. Separate from likelihood workload."
  },
  "hardware": {
    "os": "Windows-10-10.0.19045-SP0",
    "python": "3.12.3",
    "cpu": "AMD64 Family 25 Model 97 Stepping 2, AuthenticAMD",
    "logical_cpu_count": 12,
    "physical_cpu_count": 6,
    "telemetry_scope": "whole selected device; process-tree RSS may double-count shared pages",
    "snapshot": {
      "monotonic_s": 145174.828,
      "gpu_index": "0",
      "gpu_uuid": "GPU-ef1d32f1-00a8-ede3-944b-4401921843cf",
      "gpu_name": "NVIDIA GeForce RTX 4070 SUPER",
      "driver_version": "610.88",
      "vram_total_mib": 12282.0,
      "vram_used_mib": 1470.0,
      "gpu_utilization_percent": 8.0,
      "gpu_temperature_c": 54.0,
      "gpu_telemetry_error": null,
      "system_ram_total_mib": 32402.54296875,
      "system_ram_used_mib": 14171.32421875,
      "system_ram_available_mib": 18231.21875,
      "process_tree_rss_mib": null
    }
  },
  "provenance": {
    "model_sha256": "88d9134f85eec8ce75f39d2654fbcfd570fdda68821936ded67b177c0d4b326e",
    "model_size_bytes": 4069679264,
    "server_sha256": "aa2e1f5c67be55f11be26ae58d643a545ca07c6de498f6f870330ac2f4dfec73",
    "config_sha256": "479efacdeb1b10874cff47e2af0a6c2ae0ca83aa1e69f329563c3d9f77b2eccb",
    "runtime_library_sha256": {
      "cublas64_12.dll": "e40202fe4223c1cd2d2dce7beec59e1ed61c7801bd827309183be9b50e358f4c",
      "cublasLt64_12.dll": "2a896460bef60ed57ef32b0875812f355a6984e671d638bb632f5e8c1d7a831f",
      "cudart64_12.dll": "d28e42265da7462162a54da6b7a99ea4fa2caf8139d862bb500db875d0b32dfc",
      "ggml-base.dll": "645538131f61107314a1fb38ee43b392ce76a16d1a6811f065b693c9552d8e18",
      "ggml-cpu-alderlake.dll": "79bd5a3a21e574963312518c43c99ce76d10aa80651f658ac00003aae1f3fe01",
      "ggml-cpu-cannonlake.dll": "9959698ba5b224a2541d72f711ec856133e010ee95854b70fd034f2c56a4ee05",
      "ggml-cpu-cascadelake.dll": "edf3ffb10c59cbce92880c82f9580aae8dbf9c41d7e798a5cd8b4ca0acb10167",
      "ggml-cpu-cooperlake.dll": "b726f7689ec7b5f5b67aa37bacb8c36348450f535aaf86f68a6756b9f90c98a0",
      "ggml-cpu-haswell.dll": "97302fa13b3fd496828e6f4936ac01433532880cf8277de6bc8b0117add0b816",
      "ggml-cpu-icelake.dll": "d29a2b47db63d0acb29ca6314cc4a9e0579592d0bbde42926bcab525296bd464",
      "ggml-cpu-ivybridge.dll": "b742628d4a73f24dad4a4c516d8600b7d50d2e7c07cf6011592bb0f0bda45349",
      "ggml-cpu-piledriver.dll": "04540f47f6a6d1ccabbb9a92470a9d27ddff6c47cb015b38f9383ac83a93fc5f",
      "ggml-cpu-sandybridge.dll": "96d99740a206893d081e61a2e2c32ea2b999be0cc82410182e232d2d8041a392",
      "ggml-cpu-sapphirerapids.dll": "858ea2d8375a94d61d9a80e98ef8f8a88f1ef7c537e98eb69752129fab7cedd2",
      "ggml-cpu-skylakex.dll": "2b6ac583bbea84b6649ebfbf771907df208c9bfac33d024adb430a853018b396",
      "ggml-cpu-sse42.dll": "5c23106448a1edfb2683fcc955df017e8e4bdb3330114afa948c1870f8d7a91f",
      "ggml-cpu-x64.dll": "9241c4023de3b08eadcb56314bf51ac2bd338b12c4008fa4950c30068c11afb6",
      "ggml-cpu-zen4.dll": "b8f6bd5d70bc608cd2d752ae74bbf85925c2945267bb0eded15aab324ff9716a",
      "ggml-cuda.dll": "8ca6d2e63709cab79f6c87ca3153e61e409aba6592e83c0c74bac74e222952d1",
      "ggml-rpc.dll": "39948a2e2e40454421ac819cda1b4da56a12df93e2c00c2ebdd24df2c448c857",
      "ggml.dll": "9865b315ce521f45b79c50f1d5cfb56cf9f94f186aac3ed0fceebd67f46e48c7",
      "libomp.dll": "a12116ba72d1d6820407cf30be23da04ce79d6bb8a71a5ee71759c5a1faa6f1c",
      "llama-batched-bench-impl.dll": "ae139d30f4aa2a6b47279e6b9d1848c69f8ac7572c1f3ef3b9a239900fcc8c01",
      "llama-bench-impl.dll": "52b07f0fd3a6004b2de6485c1f7f8f5438bf3709eea14dfcd30fc4ec2f57f067",
      "llama-cli-impl.dll": "4d35886296714799c6ca5aece1ef3e036da7982abacd1056fdf6424a31f13b61",
      "llama-common.dll": "a9590b558f417f54d17fc688961959b3f4a95038195732adc41faab1999b69e3",
      "llama-completion-impl.dll": "04526c3dfea986a6e058609fb7d2944612b4f9f7fd5a50235e3b60fd4fbe2d94",
      "llama-fit-params-impl.dll": "567911c481d9d6d9111b128de622bd9e1a201fe2fb6f060034b030794cc861a2",
      "llama-perplexity-impl.dll": "52a6213fcb4f06494c8c0b72d52d863124877f4cf87301375a2fe0fa4b075fe2",
      "llama-quantize-impl.dll": "bcaa4cf05a476f06a09f3911f84b6e2576280b5fd9f23e775c9997b4fce7b8f3",
      "llama-server-impl.dll": "16913f79cdf57f0f80e618aeff139aa0ae096f8f935b06a02510c556e976d9d4",
      "llama.dll": "d5fed9f3fe95f03dce3714500903763356122faf1ae98a6179e6490f090c3798",
      "mtmd.dll": "5a8a0e95ea7b3da360e1ace6325fa441834a2b01fbe9c50639fb7f0c5d57c479"
    },
    "source_sha256": {
      "__init__.py": "ea45c03accb4903efa01040017cf6379e2ca48f7f1502629df6d99ae65e1b83a",
      "__main__.py": "935a1c1166b0c1ea35a82256345000bf2c73ded718d77773bc27a71ecce28f7d",
      "backends/__init__.py": "317c9e77aecca6cb786cd263dce0e6a7e1ff70388837145cd93ccda32dda3e6a",
      "backends/base.py": "4124d45f774ba8f5210a6ee64ea5731e34fbd782b48f70d18771deab43b1f1a1",
      "backends/llama_cpp.py": "6bd6163362c6428fad1fc59b0b7eedb9280dd7e1faba5ea996bd925fcd0c51ce",
      "backends/process.py": "5cb12b987956305d01bf2e99916ed5fef1fa06f7e6483ab0c3e5fcdb16df09d4",
      "backends/synthetic.py": "bc05a666200d92d2bfef981b3a4fdfec6369901ccd379b1aeee43c44104cb780",
      "cli.py": "8e2141e4f0f26e3872486e507b9f209901fe74dd70256b944baac4f8774b260e",
      "config.py": "b14539cd8ed9c3aa8a2b1302ea8dadfe7ed00b80aa9abed436c8804392a874ee",
      "hardware.py": "c02e9e80bb4f1332b2a9ecf26250a18297ff3750a4e7d1e7b153716880ffbfb1",
      "io.py": "bed3a0cf1e020c1af054401a8d414fe4dcfc5b96abb6189dba8d69e1d964851c",
      "quality.py": "c52d793cce49ca85dc90cf42d6bb938c1b29f5c60735e2b949171ed71b8e8a64",
      "report.py": "1b47a15f56f5e9df17ae2b033909adaa0c55a47b243ffcccf2abb7911e466637",
      "runner.py": "e3a0092e6938ade9b591fdbece1448979ec1272662372cb84a7cb44678ba1169"
    }
  },
  "attempts": [
    {
      "attempt_id": "ctx2k-r1-a0",
      "case_name": "ctx2k",
      "repetition": 1,
      "attempt_index": 0,
      "parent_attempt_id": null,
      "status": "SUCCESS",
      "error": null,
      "synthetic": false,
      "requested": {
        "name": "ctx2k",
        "context_size": 2048,
        "prompt_tokens": 1792,
        "output_tokens": 128,
        "gpu_layers": 99,
        "threads": 6,
        "batch_size": 512,
        "ubatch_size": 128,
        "cache_type_k": "f16",
        "cache_type_v": "f16",
        "flash_attention": "on",
        "fallbacks": []
      },
      "runtime": {
        "load_time_s": 1.904334499995457,
        "runtime_version": "version: 0.4.1-dev (build 10964, commit b29c606e2)\nbuilt with Clang 20.1.8 for Windows x86_64",
        "argv": [
          "D:\\LocalLargeModel\\runtimes\\upstream\\llama-server.exe",
          "--model",
          "D:\\LocalLargeModel\\outputs\\quality-study\\prepared-v2\\Qwen3-1.7B-F16.gguf",
          "--host",
          "127.0.0.1",
          "--port",
          "54073",
          "--api-key",
          "83d7b1f894da4a6c88a4db4ad75c1eaf",
          "--ctx-size",
          "2048",
          "--parallel",
          "1",
          "--n-gpu-layers",
          "99",
          "--threads",
          "6",
          "--batch-size",
          "512",
          "--ubatch-size",
          "128",
          "--cache-type-k",
          "f16",
          "--cache-type-v",
          "f16",
          "--flash-attn",
          "on",
          "--fit",
          "off",
          "--cache-ram",
          "0",
          "--no-context-shift",
          "--no-warmup",
          "--slots",
          "--slot-save-path",
          "D:\\LocalLargeModel\\outputs\\quality-study\\performance\\08-F16\\attempts\\ctx2k-r1-a0\\slot-cache",
          "--verbosity",
          "4",
          "--no-webui"
        ],
        "effective": {
          "context_size": 2048,
          "parallel": 1,
          "gpu_layers_loaded": 29,
          "gpu_layers_total": 29,
          "cpu_offload": false,
          "automatic_fit": false,
          "prompt_cache": false,
          "context_shift": false,
          "verification_warnings": [],
          "cache_type_k": "f16",
          "cache_type_v": "f16",
          "flash_attention": "on",
          "gpu_device": "GPU-ef1d32f1-00a8-ede3-944b-4401921843cf"
        },
        "prompt_sha256": "fb2c896342e64800d9ef58b500b33c5b9758f4b777d65f630568490d5de228e9",
        "cleanup": {
          "success": true,
          "remaining_pids": [],
          "exit_code": 1,
          "errors": []
        }
      },
      "metrics": {
        "load_time_s": 1.904334499995457,
        "ttft_s": 0.20775279999361373,
        "total_latency_s": 1.4287101000081748,